{
  "$id": "recipe",
  "$schema": "http://json-schema.org/draft-07/schema#",
  "title": "Recipe",
  "type": "object",
  "required": [
    "name",
    "yield",
    "ingredients",
    "sections"
  ],
  "properties": {
    "name": {
      "type": "string",
      "minLength": 5
    },
    "yield": {
      "type": "string",
      "minLength": 1
    },
    "ingredients": {
      "type": "array",
      "minItems": 1,
      "items": {
        "$ref": "IngredientSchema.json"
      }
    },
    "sections": {
      "type": "array",
      "minItems": 1,
      "items": {
        "$ref": "SectionSchema.json"
      }
    },
    "reviews": {
      "type": "array",
      "items": {
        "$ref": "ReviewSchema.json"
      }
    }
  }
}